12,CH11,12,CH11-012,CH11-012,【なぜかお金に困らない人の口癖】ブッダが教える、豊かさを引き寄せる「感謝」の言葉の力,script_validated,,workspaces/scripts/CH11/012/content/assembled.md,✅完了,10209,2025-10-29 21:44:05,,,,お金への不安が尽きないシニア層に対し、精神的な豊かさが物質的な豊かさを引き寄せるという仏教的な視点を提供。「お金がない」という思い込みから解放します。,他人の目や言葉に振り回されがちな40〜60代。真面目で優しいがゆえに、人間関係・老後・お金・孤独の不安を抱え、仏教の整理術で心を軽くしたいと願っている人。,【導入】「またお金がない…」が口癖になっていませんか？【貧乏神の正体】「足りない」という欠乏感が、さらなる不足を引き寄せる。【ブッダの教え】「喜捨（きしゃ）」の精神を解説。見返りを求めず、喜んで与える心を持つ人に、富は自然と集まる。「足るを知る」ことの重要性を説く。【実践法】①お金を支払う時「ありがとう」と心で唱える。②今あるもの（家、食事、健康）を数え、感謝する。③「おかげさまで」を口癖にする。【結論】お金はエネルギー。感謝という温かいエネルギーで満たせば、豊かさは自然と循環し始める。,,,,,待機中,,,その口癖が、貧乏神を追い出す。,,,https://www.youtube.com/@himitu-o4p https://www.youtube.com/@shaka__namu YouTubeサムネイル画像。暗く古びた財布から、金色の蝶が光を放ちながら飛び立っている。貧しさからの解放と豊かさへの変化を象徴。画面上部に、力強い金色の明朝体で「その口癖が、貧乏神を追い出す。」と表示。左下隅に「ブッダの教え」の黄色いラベル。寓話的で希望に満ちたスタイル。アスペクト比16:9。,,,,workspaces/scripts/CH11/012/content/assembled.md,,,,,,,,,,,
13,CH11,13,CH11-013,CH11-013,【心が楽になる鈍感力】いちいち傷つかない人が実践している、ブッダの「受け流す」智慧,script_validated,1.0,workspaces/scripts/CH11/013/content/assembled.md,✅完了,9917,2025-10-29 21:44:05,,,,他人の言動に一喜一憂し、心が疲弊しがちな人へ。「鈍感力」を仏教の智慧として肯定的に捉え直し、心の平穏を保つための処世術を授けます。,他人の目や言葉に振り回されがちな40〜60代。真面目で優しいがゆえに、人間関係・老後・お金・孤独の不安を抱え、仏教の整理術で心を軽くしたいと願っている人。,【導入】「あの人の一言が、ずっと頭から離れない…」そんな経験はありませんか？【ブッダの逸話】悪口を言われたブッダが「受け取らなければ、その贈り物は相手のものだ」と返した話を紹介。【受け流す技術】①それは「相手の問題」であり、自分の問題ではないと線を引く。②すべての評価は、相手の主観に過ぎないと理解する（諸法無我）。③自分の中に「絶対的な価値」を置けば、他人の評価は揺らがない。【実践法】悪意を感じたら、心の中で「これはプレゼントですが、私は受け取りません」と宣言する。【結論】傷つくかどうかは、自分が決めている。心の扉を開けるも閉めるも自分次第。鈍感力は、自分を守るための優しさです。,,,,,待機中,,,「気にしない人」は、こう考えている。,,,https://www.youtube.com/@himitu-o4p https://www.youtube.com/@shaka__namu YouTubeサムネイル画像。降り注ぐ言葉の矢（雨のように）を、一人の人物が傘をさして平然と受け流している。人物は穏やかな表情。画面下部に、少し太めの白のゴシック体で「『気にしない人』は、こう考えている。」と表示。左下隅に「ブッダの教え」の黄色いラベル。シンプルで象徴的なスタイル。アスペクト比16:9。,,,,workspaces/scripts/CH11/013/content/assembled.md,,,,,,,,,,,
14,CH11,14,CH11-014,CH11-014,【老後の夫婦関係】もう我慢しない。つかず離れず、心地よい距離感を保つブッダの教え,script_validated,,workspaces/scripts/CH11/014/content/assembled.md,✅完了,9964,2025-10-29 21:44:05,,,,長年連れ添った夫婦が直面する「熟年期のすれ違い」に焦点を当てる。互いを尊重し、穏やかな関係を築くためのヒントを仏教の視点から提供します。,他人の目や言葉に振り回されがちな40〜60代。真面目で優しいがゆえに、人間関係・老後・お金・孤独の不安を抱え、仏教の整理術で心を軽くしたいと願っている人。,【導入】定年後、夫（妻）がずっと家にいて息が詰まる…という悩み。【執着を手放す】「相手はこうあるべき」という期待が苦しみを生む。相手は変えられないと知ることが第一歩。【ブッダの教え】「自灯明、法灯明」を夫婦関係に応用。自分自身を頼りとし、相手に依存しすぎない。互いが自立した上で、支え合う関係が理想。【実践法】①感謝の言葉を意識して使う。「ありがとう」は潤滑油。②一人の時間を尊重する。干渉しない。③やってほしいことは「察して」ではなく、穏やかに言葉で伝える。【結論】夫婦といえど、元は他人。違いを認め、尊重し合うこと。心地よい距離感が、二人の関係を最後まで温かいものにする。,,,,,待機中,,,その一言が、二人を永遠に分かつ。,,,https://www.youtube.com/@himitu-o4p https://www.youtube.com/@shaka__namu YouTubeサムネイル画像。二つのティーカップが、縁側で適度な距離を置いて置かれている。背景には穏やかな庭が広がり、静かで落ち着いた時間が流れている。片方のカップにだけひびが入っている。画面上部に、警告的な赤色の明朝体で「その一言が、二人を永遠に分かつ。」と表示。左下隅に「ブッダの教え」の黄色いラベル。静かで暗示的な写実スタイル。アスペクト比16:9。,,,,workspaces/scripts/CH11/014/content/assembled.md,,,,,,,,,,,
15,CH11,15,CH11-015,CH11-015,【寝る前5分でできること】今日の不安をリセットし、幸運を引き寄せる夜の習慣｜ブッダの瞑想法,script_validated,1.0,workspaces/scripts/CH11/015/content/assembled.md,✅完了,8608,2025-10-29 21:44:05,,,,将来への不安や日中のイライラで寝付けないシニア層へ。仏教の瞑想を応用した、誰でもできる簡単な夜の習慣を提案し、安らかな眠りと前向きな明日を約束します。,他人の目や言葉に振り回されがちな40〜60代。真面目で優しいがゆえに、人間関係・老後・お金・孤独の不安を抱え、仏教の整理術で心を軽くしたいと願っている人。,【導入】ベッドに入ると、なぜか嫌なことばかり思い出してしまう…そんな夜に。【慈悲の瞑想】ブッダが説いた「慈悲の瞑想」を簡単にアレンジして紹介。【実践法】①布団の中で楽な姿勢になる。②まず自分自身に「私が幸せでありますように」と唱える。③次に身近な人に「あなたが幸せでありますように」と祈る。④最後に「生きとし生けるものが幸せでありますように」と範囲を広げる。【瞑想の効果】ネガティブな自己対話が止まり、心が感謝と優しさで満たされる。脳がリラックスし、質の良い睡眠に入れる。【結論】一日の終わりを、不安ではなく感謝で締めくくる。この小さな習慣が、あなたの明日を、そして人生を静かに変えていく。,,,,,待機中,,,その日の悩みは、その日のうちに消す。,,,https://www.youtube.com/@himitu-o4p https://www.youtube.com/@shaka__namu YouTubeサムネイル画像。暗い寝室で、人物の心臓部分から温かい光が溢れ出し、部屋全体を優しく照らしている。穏やかで安心感のあるイメージ。画面下部に、夜空に浮かぶ月のような白い明朝体で「その日の悩みは、その日のうちに消す。」と表示。左下隅に「ブッダの教え」の黄色いラベル。幻想的で温かいスタイル。アスペクト比16:9。,,,,workspaces/scripts/CH11/015/content/assembled.md,,,,,,,,,,,
16,CH11,16,CH11-016,CH11-016,【病と共に生きる智慧】病気になって初めてわかる、本当の幸せとは｜ブッダの教え,script_validated,,workspaces/scripts/CH11/016/content/assembled.md,✅完了,9807,2025-10-29 21:44:05,,,,病気を患い、気力や希望を失いかけている視聴者に寄り添う。病を「罰」や「敵」と捉えるのではなく、生き方を見つめ直す「きっかけ」と捉える仏教的な視点を提供します。,他人の目や言葉に振り回されがちな40〜60代。真面目で優しいがゆえに、人間関係・老後・お金・孤独の不安を抱え、仏教の整理術で心を軽くしたいと願っている人。,【導入】「なぜ自分がこんな病気に…」と運命を呪いたくなる気持ちに共感。【ブッダの教え】ブッダ自身も老いと病、死を避けることはできなかった。「生老病死」は誰もが体験する自然なことだと説く。【病が教えてくれること】①当たり前だった健康への感謝。②人の優しさ。③本当に大切なものが見えてくる。【実践法】①痛みに抵抗せず「今、痛みがある」と客観的に受け止める。②「できたこと」を数える。今日一杯の水が飲めた、窓の外を見れたなど。③病気の自分を責めない。【結論】病は、人生の強制終了ではない。生き方を変え、本当に大切なものに気づかせてくれるための「目覚まし時計」なのかもしれない。,,,,,待機中,,,病は、あなたを殺すために来たのではない。,,,https://www.youtube.com/@himitu-o4p https://www.youtube.com/@shaka__namu YouTubeサムネイル画像。嵐で折れ、枯れかけた木。しかし、その折れた幹の隙間から、一輪の力強い花が咲いている。逆境の中にある生命力と希望を表現。画面中央に、優しくも力強い白のゴシック体で「病は、あなたを殺すために来たのではない。」と表示。左下隅に「ブッダの教え」の黄色いラベル。感動的で写実的なスタイル。アスペクト比16:9。,,,,workspaces/scripts/CH11/016/content/assembled.md,,,,,,,,,,,
17,CH11,17,CH11-017,CH11-017,【人を見る目】一瞬で「裏表のある人」を見抜くブッダの観察術｜本当に信用できる人の特徴,script_validated,,workspaces/scripts/CH11/017/content/assembled.md,✅完了,3317,2025-10-29 21:44:05,,,,人の良さにつけ込まれたり、人間関係で失敗したりした経験を持つシニア層へ。口先だけの人に惑わされず、本質的に信頼できる人を見抜くための仏教的な観察眼を伝授します。,他人の目や言葉に振り回されがちな40〜60代。真面目で優しいがゆえに、人間関係・老後・お金・孤独の不安を抱え、仏教の整理術で心を軽くしたいと願っている人。,【導入】「あんなに良い人だと思ったのに…」と裏切られた経験はありませんか？【ブッダの教え】「言葉」は偽れるが、「行い」には本性が現れる。【見抜くポイント】①自分より弱い立場の人への態度（店員、子供、動物など）。②誰も見ていないところでの行い（ゴミのポイ捨て、公共の場でのマナー）。③都合が悪くなった時の反応（言い訳、責任転嫁）。【信用できる人の特徴】言行が一致している。与えることを喜びとする。人の成功を素直に喜べる。【結論】人の本性は、日常の些細な、無意識の行動にこそ現れる。言葉に惑わされず、静かに行いを観察する「智慧の目」を持ちましょう。,,,,,待機中,,,言葉ではなく、〇〇を見なさい。,,,[無効な URL を削除しました] YouTubeサムネイル画像。仮面（笑顔）を手に持ち、その下にある無表情な顔が少しだけ見えている人物。洞察と真実を見抜く目を象徴する。画面下部に、ミステリアスな雰囲気の明朝体で「言葉ではなく、〇〇を見なさい。」と表示（〇〇は空白）。左下隅に「ブッダの教え」の黄色いラベル。ドラマチックで寓話的なスタイル。アスペクト比16:9。,,,,workspaces/scripts/CH11/017/content/assembled.md,,,,,,,,,,,
18,CH11,18,CH11-018,CH11-018,【幸運な晩年】なぜかいつもご機嫌な人が、無意識にやっている「徳を積む」習慣,script_validated,1.0,workspaces/scripts/CH11/018/content/assembled.md,✅完了,5951,2025-10-29 21:44:05,,,,「自分もあんな風に年を取りたい」と思われるような、穏やかで幸運な晩年を送るための秘訣を解き明かす。目に見えない「徳」という概念を、具体的な日常の行動に落とし込みます。,他人の目や言葉に振り回されがちな40〜60代。真面目で優しいがゆえに、人間関係・老後・お金・孤独の不安を抱え、仏教の整理術で心を軽くしたいと願っている人。,【導入】あなたの周りに、いつも穏やかで、なぜか運が良さそうな人はいませんか？【徳とは何か】人知れず行う、見返りを求めない小さな親切。陰徳を積むこと。【徳を積む習慣】①トイレのスリッパを揃える。②落ちているゴミを拾う。③笑顔で挨拶する。④相手の良いところを褒める。⑤感謝を言葉にする。【ブッダの教え】「塵も積もれば山となる」ように、小さな善行（功徳）の積み重ねが、大きな幸運となって自分に返ってくる（因果応報）。【結論】幸運は、求めるものではなく、日々の行いの結果として自然と与えられるもの。誰のためでもない、自分の心を磨くための小さな習慣を始めてみませんか。,,,,,待機中,,,その行いが、あなたを天に押し上げる。,,,https://www.youtube.com/@himitu-o4p https://www.youtube.com/@shaka__namu YouTubeサムネイル画像。一人の人物が、誰も見ていない道端に咲く一輪の花に、そっと水をやっている。その人物の背後から、温かい光が後光のように差している。画面中央に、少し筆文字風の白のフォントで「その行いが、あなたを天に押し上げる。」と表示。左下隅に「ブッダの教え」の黄色いラベル。心温まる、スピリチュアルなスタイル。アスペクト比16:9。,,,,workspaces/scripts/CH11/018/content/assembled.md,,,,,,,,,,,
19,CH11,19,CH11-019,CH11-019,【もう比べない生き方】SNSや他人の成功が気になるとき、心がスーッと軽くなるブッダの言葉,script_validated,,workspaces/scripts/CH11/019/content/assembled.md,✅完了,5647,2025-10-29 21:44:05,,,,他人の華やかな暮らしや成功を見て、焦りや嫉妬を感じてしまう人へ。自分軸で生きるための仏教の智慧を伝え、他者比較という苦しみから解放します。,他人の目や言葉に振り回されがちな40〜60代。真面目で優しいがゆえに、人間関係・老後・お金・孤独の不安を抱え、仏教の整理術で心を軽くしたいと願っている人。,【導入】友人の旅行写真、成功した同級生の話…見ていて心がザワつくことはありませんか？【比較の苦しみ】上を見ればキリがなく、下を見て安心するのは束の間。比較の世界に安住の地はない。【ブッダの教え】「天上天下唯我独尊」の本当の意味を解説。誰もが唯一無二の尊い存在であり、比べること自体が無意味であると説く。人はそれぞれの花を、それぞれのタイミングで咲かせる。【実践法】①SNSを見る時間を減らす。②自分の「小さな幸せ」に目を向ける（今日の食事が美味しい、花が綺麗など）。③過去の自分とだけ比べる。「昨日より少し成長できた」ことを褒める。【結論】他人という物差しを捨てた時、初めて自分の価値が見えてくる。あなたはあなたの道を、あなたのペースで歩めばいい。,,,,,待機中,,,あなたは、あなたのままで素晴らしい。,,,https://www.youtube.com/@himitu-o4p https://www.youtube.com/@shaka__namu YouTubeサムネイル画像。たくさんの同じような花が咲く中で、一輪だけ全く違う種類の花が、堂々と誇らしげに咲いている。多様性と個性の尊重を象徴。画面下部に、優しく肯定的な白の明朝体で「あなたは、あなたのままで素晴らしい。」と表示。左下隅に「ブッダの教え」の黄色いラベル。美しく、感動的なスタイル。アスペクト比16:9。,,,,workspaces/scripts/CH11/019/content/assembled.md,,,,,,,,,,,
20,CH11,20,CH11-020,CH11-020,【人生が虚しいと感じたら】何をやっても楽しくないあなたへ。ブッダが教える「生きる意味」の見つけ方,script_validated,,workspaces/scripts/CH11/020/content/assembled.md,✅完了,9279,2025-10-29 21:44:05,,,,定年後や子育て後に訪れる「燃え尽き症候群」や虚無感に悩む人へ。人生の新しいステージで、生きがいや喜びを見つけるための仏教的なアプローチを提案します。,他人の目や言葉に振り回されがちな40〜60代。真面目で優しいがゆえに、人間関係・老後・お金・孤独の不安を抱え、仏教の整理術で心を軽くしたいと願っている人。,【導入】毎日が同じことの繰り返し…心が空っぽで、何を見ても感動しない。そんな「虚しさ」の正体とは？【虚しさの原因】自分自身のためだけに生きてきた結果。自己中心的な喜びには限界がある。【ブッダの教え】「利他（りた）」の精神を解説。誰かのために何かをすることが、巡り巡って自分の心を最も満たす。生きる意味は、与えられるものではなく、与える中に見出すもの。【実践法】①大げさでなくていい。家族のために美味しいお茶を入れる。②地域のボランティアに参加してみる。③誰かの話をただ真剣に聞いてあげる。【結論】あなたの経験や時間は、誰かを助ける力になる。空っぽになったコップに、誰かのための喜びという水を注ぐとき、あなたの心は再び満たされ始める。,,,,,待機中,,,その虚しさ、魂が目覚めるサインです。,,,https://www.youtube.com/@himitu-o4p https://www.youtube.com/@shaka__namu YouTubeサムネイル画像。ひび割れて乾いた大地（心）に、一人の人物が水差しから一滴の水を垂らすと、そこから美しい蓮の花が咲き始める。希望と再生の象徴。画面上部に、神秘的な白のゴシック体で「その虚しさ、魂が目覚めるサインです。」と表示。左下隅に「ブッダの教え」の黄色いラベル。幻想的でスピリチュアルなスタイル。アスペクト比16:9。,,,,workspaces/scripts/CH11/020/content/assembled.md,,,,,,,,,,,
21,CH11,21,CH11-021,CH11-021,【話の聞き方ひとつで変わる】なぜか人が集まる人の「究極の傾聴術」｜ブッダの教え,script_validated,1.0,workspaces/scripts/CH11/021/content/assembled.md,✅完了,6268,2025-10-29 21:44:05,,,,「話が長い」「自慢話ばかり」と敬遠されがちなシニア層が「聞き上手」になることで、人間関係を劇的に改善する方法を提案。コミュニケーションの悩みを解決します。,他人の目や言葉に振り回されがちな40〜60代。真面目で優しいがゆえに、人間関係・老後・お金・孤独の不安を抱え、仏教の整理術で心を軽くしたいと願っている人。,【導入】良かれと思ってアドバイスしたら、相手に嫌な顔をされた経験は？【聞くことの効用】人は自分の話を真剣に聞いてくれる人が大好き。承認欲求が満たされ、心を開く。【ブッダの教え】仏教では、人の話をよく聞くことを「聞法（もんぽう）」といい、重要な修行と位置づける。【実践法】①口を挟まず、最後まで聞く。②相槌を打つ（「へえ」「それで？」）。③相手の言ったことを繰り返す（「〇〇だったんですね」）。④自分の意見を言わない。質問だけする。【結論】最高のコミュニケーションとは、うまく話すことではない。いかに相手に気持ちよく話してもらうか。聞き上手の周りには、自然と人が集まり、良い情報も舞い込んでくる。,,,,,待機中,,,ただ聞くだけで、相手はあなたを好きになる。,,,https://www.youtube.com/@himitu-o4p https://www.youtube.com/@shaka__namu YouTubeサムネイル画像。二人の人物のシルエット。一人が話しており、その口から出る言葉が蝶のように飛んでいる。もう一人は静かに耳を傾け、その蝶が手のひらに止まるのを優しく見つめている。画面下部に、穏やかな白の明朝体で「ただ聞くだけで、相手はあなたを好きになる。」と表示。左下隅に「ブッダの教え」の黄色いラベル。詩的で優しい雰囲気のスタイル。アスペクト比16:9。,,,,workspaces/scripts/CH11/021/content/assembled.md,,,,,,,,,,,
22,CH11,22,CH11-022,CH11-022,【老いるのが楽しくなる考え方】シワや白髪は「醜い」のではなく「美しい」ブッダの智慧,script_validated,,workspaces/scripts/CH11/022/content/assembled.md,✅完了,6563,2025-10-29 21:44:05,,,,「老い」に対するネガティブなイメージを払拭し、年を重ねることを肯定的に捉え直す視点を提供。シニア層の自己肯定感を高め、生きる勇気を与えます。,他人の目や言葉に振り回されがちな40〜60代。真面目で優しいがゆえに、人間関係・老後・お金・孤独の不安を抱え、仏教の整理術で心を軽くしたいと願っている人。,【導入】鏡を見るたび、増えるシワや白髪にため息をついていませんか？【老いの価値】若さ＝価値という社会の刷り込みから自由になる。経験、知識、円熟味は、若さにはない宝物。【ブッダの教え】「諸行無常」を受け入れる。若さが永遠でないように、老いもまた変化の一過程。年輪を重ねた木が美しいように、人生の年輪もまた尊い。【老いを美しさに変える】①経験を分かち合う。②寛容になる。③笑顔を心がける（最高の美容液）。【結論】シワは、笑った記憶、涙した記憶。白髪は、悩み抜いた証。あなたの顔は、あなたが懸命に生きてきた歴史そのもの。世界に一つだけの美しい芸術作品なのです。,,,,,待機中,,,そのシワは、あなたが戦ってきた勲章です。,,,https://www.youtube.com/@himitu-o4p https://www.youtube.com/@shaka__namu YouTubeサムネイル画像。高齢者の顔のクローズアップ。シワが、まるで木の年輪や大地の地図のように、美しく威厳のある模様として描かれている。その目には深い智慧と穏やかな光が宿っている。画面下部に、力強く感動的な白のゴシック体で「そのシワは、あなたが戦ってきた勲章です。」と表示。左下隅に「ブッダの教え」の黄色いラベル。芸術的で力強い写実スタイル。アスペクト比16:9。,,,,workspaces/scripts/CH11/022/content/assembled.md,,,,,,,,,,,
