23,CH11,23,CH11-023,CH11-023,【もう執着しない】失ったものを数えるのをやめ、今あるものに感謝するブッダの心の整え方,script_validated,,workspaces/scripts/CH11/023/content/assembled.md,✅完了,6263,2025-10-29 21:44:05,,,,過去の栄光、失った健康、去っていった人…「失ったもの」に心を囚われ、前に進めないシニア層へ。執着を手放し、今この瞬間の幸せに気づくための方法を説きます。,他人の目や言葉に振り回されがちな40〜60代。真面目で優しいがゆえに、人間関係・老後・お金・孤独の不安を抱え、仏教の整理術で心を軽くしたいと願っている人。,【導入】「昔は良かった」「あれさえあれば」と、ないものばかりを数えていませんか？【執着の苦しみ】握りしめた拳には、何も新しいものは入らない。執着は、自分自身を過去に縛り付ける鎖。【ブッダの教え】苦しみの原因は執着にある（集諦）。すべては移り変わる（諸行無常）と知れば、執着は和らぐ。【実践法】①感謝ノートをつける。今日あった良いことを3つ書く。②失ったものから得た教訓を一つだけ見つける。③呼吸に集中する瞑想で「今、ここ」に意識を戻す。【結論】過去を失ったのではない。過去から卒業したのだ。手放すことは、失うことではなく、新しい豊かさを受け入れるためのスペースを作ること。,,,,,待機中,,,手放した瞬間、本当に大切なものが見える。,,,https://www.youtube.com/@himitu-o4p https://www.youtube.com/@shaka__namu YouTubeサムネイル画像。人物の手が、砂（過去の執着）をサラサラと手放している。そして、その空になった手のひらに、天から一筋の光が差し込み、新しい芽生えを予感させる。画面下部に、静かな白の明朝体で「手放した瞬間、本当に大切なものが見える。」と表示。左下隅に「ブッダの教え」の黄色いラベル。象徴的でスピリチュアルなスタイル。アスペクト比16:9。,,,,workspaces/scripts/CH11/023/content/assembled.md,,,,,,,,,,,
24,CH11,24,CH11-024,CH11-024,【許せない人がいるあなたへ】憎しみの連鎖を断ち切り、自分の心を守るブッダの最終手段,script_validated,1.0,workspaces/scripts/CH11/024/content/assembled.md,✅完了,6120,2025-10-29 21:44:05,,,,過去の裏切りや許せない出来事に長年苦しんでいる人へ。「許し」は相手のためではなく、自分の心の平穏を取り戻すための行為であると説き、苦しみからの解放を促します。,他人の目や言葉に振り回されがちな40〜60代。真面目で優しいがゆえに、人間関係・老後・お金・孤独の不安を抱え、仏教の整理術で心を軽くしたいと願っている人。,【導入】あの人のことだけは、どうしても許せない…その憎しみの炎で、本当に燃えているのは誰でしょう？【憎しみの害】憎しみは、相手ではなく自分の心と体を蝕む毒。相手はあなたを忘れても、あなたは相手を考え続けることになる。【ブッダの教え】「一切衆生悉有仏性」すべての命には仏の心が宿っている。相手もまた、迷い苦しむ不完全な存在だと見る。【実践法】①許す必要はない。ただ「その出来事はもう終わった」と事実を認める。②相手の幸せを祈る（慈悲の瞑想）。これは非常に難しいが、最も効果的な方法。③自分の人生に集中し、相手を心の中から追い出す。【結論】許しとは、相手を無罪放免にすることではない。自分がその重荷を降ろし、自由になるための賢い選択。憎しみという牢獄から、自分自身を解放してあげましょう。,,,,,待機中,,,その憎しみは、相手ではなくあなたを燃やす。,,,https://www.youtube.com/@himitu-o4p https://www.youtube.com/@shaka__namu YouTubeサムネイル画像。一人の人物が、自分の心臓に刺さった黒いトゲ（憎しみ）を、自らの手で静かに引き抜こうとしている。苦痛だが、解放への決意を感じさせる表情。画面上部に、少しひび割れたような赤色のフォントで「その憎しみは、相手ではなくあなたを燃やす。」と表示。左下隅に「ブッダの教え」の黄色いラベル。ドラマチックで感情的なスタイル。アスペクト比16:9。,,,,workspaces/scripts/CH11/024/content/assembled.md,,,,,,,,,,,
25,CH11,25,CH11-025,CH11-025,【ご先祖様に守られているサイン】あなたのそばにいる見えない力の存在に気づく時｜仏教の教え,script_validated,,workspaces/scripts/CH11/025/content/assembled.md,✅完了,5647,2025-10-29 21:44:05,,,,目に見えない存在やスピリチュアルなテーマに関心のある層へ。ご先祖様からのサポートという心温まる視点から、視聴者に安心感と、日々の行いを律する意識を与えます。,他人の目や言葉に振り回されがちな40〜60代。真面目で優しいがゆえに、人間関係・老後・お金・孤独の不安を抱え、仏教の整理術で心を軽くしたいと願っている人。,【導入】なぜか危ないところで助かった、ふと良いアイデアが浮かんだ…それは偶然ではないかもしれません。【守られているサイン】①ゾロ目をよく見る。②蝶や鳥が寄ってくる。③懐かしい香りがする。④夢に出てくる。⑤絶妙なタイミングで助けが入る。【ブッダの教え】仏教では「縁」を大切にする。ご先祖様もまた、私たちに繋がる大きな縁の一部。感謝の気持ちを持つことが大切。【実践法】①お墓参りや仏壇に手を合わせる。形だけでなく、心からの対話をする。②日々の報告と感謝を伝える。「今日も無事に過ごせました、ありがとう」と。③徳を積む（善い行いをすること）が最高のご先祖供養になる。【結論】私たちは、過去から続く多くの命の繋がりの中にある。見守ってくれている存在への感謝を忘れず、恥ずかしくない生き方をすることが、最大の恩返しです。,,,,,待機中,,,あなたは一人で生きているのではない。,,,https://www.youtube.com/@himitu-o4p https://www.youtube.com/@shaka__namu YouTubeサムネイル画像。一人の人物が道を歩いている。その背後には、半透明で光るたくさんの人影（ご先祖様）が、温かい眼差しで見守りながら付き添っている。画面下部に、神々しい金色の明朝体で「あなたは一人で生きているのではない。」と表示。左下隅に「ブッダの教え」の黄色いラベル。スピリチュアルで感動的なスタイル。アスペクト比16:9。,,,,workspaces/scripts/CH11/025/content/assembled.md,,,,,,,,,,,
26,CH11,26,CH11-026,CH11-026,【言葉の力】口にするだけで運命が変わる「天国言葉」と、人生を壊す「地獄言葉」｜ブッダの正語,script_validated,1.0,workspaces/scripts/CH11/026/content/assembled.md,✅完了,5680,2025-10-29 21:44:05,,,,言葉の持つ力（言霊）に焦点を当て、使う言葉を選ぶだけで人生が好転するという、実践的で分かりやすい開運法を提案します。,他人の目や言葉に振り回されがちな40〜60代。真面目で優しいがゆえに、人間関係・老後・お金・孤独の不安を抱え、仏教の整理術で心を軽くしたいと願っている人。,【導入】「どうせ私なんて」「疲れた」が口癖になっていませんか？その言葉が、あなたの人生をその通りに作っているとしたら…【ブッダの教え】八正道の一つ「正語（しょうご）」を解説。嘘や悪口だけでなく、無益な言葉を避け、真実で、愛情のある、役に立つ言葉を使うべきだと説く。【地獄言葉】「ついてない」「無理」「許せない」「疲れた」「面倒くさい」。これらは自己肯定感を下げ、運気を遠ざける。【天国言葉】「ありがとう」「ついている」「感謝します」「幸せ」「なんとかなる」。これらは心を前向きにし、良い縁を引き寄せる。【結論】言葉は、思考の現れであり、未来の設計図。何を言うかを選ぶことは、どんな人生を生きるかを選ぶこと。今日から、天国言葉を一つでも多く使ってみませんか。,,,,,待機中,,,その言葉が、あなたの現実を創っている。,,,https://www.youtube.com/@himitu-o4p https://www.youtube.com/@shaka__namu YouTubeサムネイル画像。人物の口から、黒いトゲのある言葉と、光り輝く蝶のような言葉の二種類が出ている。黒い言葉は地面に落ちて枯れ、光る言葉は天に昇っていく。画面中央に、対比を強調するように「その言葉が、あなたの現実を創っている。」と白抜き文字で表示。左下隅に「ブッダの教え」の黄色いラベル。善と悪の対比が明確な寓話的スタイル。アスペクト比16:9。,,,,workspaces/scripts/CH11/026/content/assembled.md,,,,,,,,,,,
27,CH11,27,CH11-027,CH11-027,【究極の断捨離】人生の最後に本当に残すべきは、たった３つだけ｜ブッダのミニマリズム,script_validated,,workspaces/scripts/CH11/027/content/assembled.md,✅完了,5965,2025-10-29 21:44:05,,,,モノの断捨離から一歩進んで、人生そのものにおける「価値観の断捨離」を提案。シニア層が残りの人生を本当に大切なことに集中できるよう導きます。,他人の目や言葉に振り回されがちな40〜60代。真面目で優しいがゆえに、人間関係・老後・お金・孤独の不安を抱え、仏教の整理術で心を軽くしたいと願っている人。,【導入】多くのモノ、多くの人間関係に囲まれて、本当に幸せですか？【捨てるべきもの】見栄、執着、過去の自慢、未来への過度な心配。【ブッダの教え】お坊さんが「三衣一鉢（さんえいっぱつ）」という最低限の持ち物しか持たない理由を解説。モノが少ないほど、心は自由になる。【残すべき３つ】①今この瞬間の、穏やかな心。②損得のない、温かい人間関係。③今日一日を生きられたことへの感謝。【実践法】一日一つ、不要なものを捨てる。モノだけでなく、「～すべき」という思い込みも捨てる。【結論】人生の荷物は、軽い方が遠くまで歩ける。全てを手放した時、最後に残るものこそが、あなたの人生の宝物です。,,,,,待機中,,,死ぬとき、ポケットにモノは入れられない。,,,https://www.youtube.com/@himitu-o4p https://www.youtube.com/@shaka__namu YouTubeサムネイル画像。広大な平原を、背中に小さな風呂敷包みだけを背負った旅人が、夕日に向かって歩いている。その表情は晴れやか。画面下部に、静かな明朝体で「死ぬとき、ポケットにモノは入れられない。」と表示。左下隅に「ブッダの教え」の黄色いラベル。ミニマリストで哲学的なスタイル。アスペクト比16:9。,,,,workspaces/scripts/CH11/027/content/assembled.md,,,,,,,,,,,
28,CH11,28,CH11-028,CH11-028,【なぜか惹かれる人の雰囲気】あなたの「人相」が変わり、運気が上がるブッダの習慣,script_validated,1.0,workspaces/scripts/CH11/028/content/assembled.md,✅完了,6012,2025-10-29 21:44:05,,,,「人相」という興味を引きやすいテーマから、内面を磨くことが外見や雰囲気にどう影響するかを仏教的に解説。スピリチュアルに関心のある層にアピールします。,他人の目や言葉に振り回されがちな40〜60代。真面目で優しいがゆえに、人間関係・老後・お金・孤独の不安を抱え、仏教の整理術で心を軽くしたいと願っている人。,【導入】言葉を交わす前から「この人、きっと良い人だ」と感じる顔はありませんか？【ブッダの教え】「和顔愛語（わげんあいご）」を解説。穏やかな顔つきと、優しい言葉は、まず自分自身の心を整え、周りの人を幸せにする最高の布施である。【運気が上がる人相】①口角が上がっている（感謝と喜び）。②目が澄んでいる（心の正直さ）。③眉間が広い（寛容さ）。これらは生まれつきではなく、心の持ち方で作られる。【人相を変える習慣】①鏡を見て口角を上げる練習。②人の悪口を言わない。③慈悲の瞑想で心を穏やかに保つ。【結論】最高の整形は、心を整えること。あなたの心がけ一つで、顔つきは変わり、雰囲気は輝き、幸運が自然と引き寄せられる人になる。,,,,,待機中,,,顔は、あなたの心が作る。,,,https://www.youtube.com/@himitu-o4p https://www.youtube.com/@shaka__namu YouTubeサムネイル画像。泥水の中から咲く美しい蓮の花と、穏やかで慈愛に満ちた表情の人物の顔が二重写しになっている。内面の美しさが外見に現れることを象徴。画面下部に、エレガントな明朝体で「顔は、あなたの心が作る。」と表示。左下隅に「ブッダの教え」の黄色いラベル。美しくスピリチュアルなスタイル。アスペクト比16:9。,,,,workspaces/scripts/CH11/028/content/assembled.md,,,,,,,,,,,
29,CH11,29,CH11-029,CH11-029,【心配性のあなたへ】まだ起きてもいないことで悩むのをやめるブッダの「今を生きる」技術,script_validated,1.0,workspaces/scripts/CH11/029/content/assembled.md,✅完了,5931,2025-10-29 21:44:05,,,,不安や心配で頭がいっぱいになりがちな人へ、仏教の根幹思想である「今、ここに集中する」ことの重要性を説き、未来への不安から心を解放します。,他人の目や言葉に振り回されがちな40〜60代。真面目で優しいがゆえに、人間関係・老後・お金・孤独の不安を抱え、仏教の整理術で心を軽くしたいと願っている人。,【導入】「もし〜なったらどうしよう」と、未来の心配ばかりしていませんか？【心配の正体】心配とは、頭の中で作り出した「物語」。それは現実ではない。【ブッダの教え】過去はすでに去り、未来はまだ来ていない。私たちが本当に生きられるのは「今、この瞬間」だけ。この瞬間に集中すれば、悩みは入り込む隙がない。【実践法】①呼吸に集中する。息を吸って、吐いて、という体の感覚に意識を向ける。②五感を使う。今見えているもの、聞こえる音、感じる温度に注意を払う。③目の前の作業（お茶を飲む、歩くなど）に100%没頭する。【結論】未来を変える力は「今」にしかない。心配する時間で、今できる小さな一歩を踏み出す。それが、最高の未来を創る唯一の方法です。,,,,,待機中,,,あなたの悩みの9割は、現実には起こらない。,,,https://www.youtube.com/@himitu-o4p https://www.youtube.com/@shaka__namu YouTubeサムネイル画像。一人の人物が、荒れ狂う嵐（頭の中の心配事）が描かれた絵の外に一歩踏み出し、穏やかで晴れ渡った現実の世界に足を踏み入れている。画面下部に、力強いゴシック体で「あなたの悩みの9割は、現実には起こらない。」と表示。左下隅に「ブッダの教え」の黄色いラベル。象徴的で希望に満ちたスタイル。アスペクト比16:9。,,,,workspaces/scripts/CH11/029/content/assembled.md,,,,,,,,,,,
30,CH11,30,CH11-030,CH11-030,【人生の迷子になったら】進むべき道がわからなくなった時に読む、ブッダからの手紙,script_validated,,workspaces/scripts/CH11/030/content/assembled.md,✅完了,5951,2025-10-29 21:44:05,,,,人生の転機や停滞期を迎え、自分がどこに向かっているのか分からなくなった人へ。ブッダが優しく語りかけるような形式で、自己肯定感を高め、進むべき道へのヒントを与えます。,他人の目や言葉に振り回されがちな40〜60代。真面目で優しいがゆえに、人間関係・老後・お金・孤独の不安を抱え、仏教の整理術で心を軽くしたいと願っている人。,【導入】まるで霧の中にいるように、進むべき道が見えない。そんなあなたへ、ブッダから一通の手紙が届いています。【ブッダからの手紙（内容）】「迷うことは、真剣に生きている証です。立ち止まることを恐れないで。全ての経験に無駄なものは一つもありません。あなたが歩んできた道そのものが、あなたの宝です。答えは外にはない。あなたの内なる声に耳を澄ませなさい（自灯明）。焦らなくていい。花が咲く時期は、それぞれ違うのだから。」【結論】道に迷った時は、成長のチャンス。この停滞期は、より高く飛ぶための準備期間。あなたは一人ではないし、間違ってもいない。安心して、今の自分を信じてあげてください。,,,,,待機中,,,大丈夫、あなたは正しい道を歩んでいる。,,,https://www.youtube.com/@himitu-o4p https://www.youtube.com/@shaka__namu YouTubeサムネイル画像。霧深い森の中で道に迷った人物。その足元から、目的地へと続く一条の光の道が、静かに現れ始めている。画面下部に、手書き風の優しいフォントで「大丈夫、あなたは正しい道を歩んでいる。」と表示。左下隅に「ブッダの教え」の黄色いラベル。幻想的で、温かく、希望に満ちたスタイル。アスペクト比16:9。,,,,workspaces/scripts/CH11/030/content/assembled.md,,,,,,,,,,,
31,CH11,31,CH11-031,CH11-031,【科学が証明したブッダの智慧】瞑想が脳と心にもたらす奇跡の効果｜ハーバード大学の研究で判明,script_validated,,workspaces/scripts/CH11/031/content/assembled.md,✅完了,5680,2025-10-29 21:44:05,,,,瞑想の科学的効果と仏教の智慧を結びつけ、心と体の両面からアプローチ。スピリチュアルに関心のある層と、健康志向の層の両方に響く内容を目指す。,他人の目や言葉に振り回されがちな40〜60代。真面目で優しいがゆえに、人間関係・老後・お金・孤独の不安を抱え、仏教の整理術で心を軽くしたいと願っている人。,"導入：ブッダが2500年前に見出した心の平穏への道が、現代科学によって証明されたことを紹介。
科学的効果：ストレス軽減、集中力向上、免疫力向上などを、ハーバード大学の研究などを引用して解説。
仏教の智慧：「今、ここ」に集中するマインドフルネスの考え方や、自分を客観視する「ヴィパッサナー瞑想」の基本を分かりやすく説明。
実践法：初心者でもできる5分間の「慈悲の瞑想」を紹介。「私が幸せでありますように」と自分を慈しむことから始める。
結論：瞑想は、科学と仏教が示す、最高のセルフケア。心と体を整え、穏やかな毎日を送るための第一歩だと締めくくる。",,,,,待機中,,,科学も認めた「心の休息法」,,,リアルな人間の脳の断面図。その中心に穏やかに座禅を組む仏陀のシルエットが光っている。背景は宇宙のような深い青。画面下部に、白く輝く明朝体で「科学も認めた『心の休息法』」と表示。,,,,workspaces/scripts/CH11/031/content/assembled.md,,,,,,,,,,,
32,CH11,32,CH11-032,CH11-032,【人間関係の悩みが消える】嫌な人から自分を守る、ブッダの「慈悲の距離」という考え方,script_validated,,workspaces/scripts/CH11/032/content/assembled.md,✅完了,5947,2025-10-29 21:44:05,,,,人間関係の断捨離を、相手を憎むのではなく、自分と相手の両方を慈しむという仏教的なアプローチで提案。罪悪感なく、健全な人間関係を築くための智慧を提供する。,他人の目や言葉に振り回されがちな40〜60代。真面目で優しいがゆえに、人間関係・老後・お金・孤独の不安を抱え、仏教の整理術で心を軽くしたいと願っている人。,"導入：「嫌いだけど、縁を切れない…」そんな苦しみは、相手を憎むことから生まれると語る。
ブッダの教え：「非理の慈悲」を解説。相手を甘やかすことは、本当の優しさではない。時には距離を置くことが、相手のためにもなる。
慈悲の距離とは：相手の幸せを願いつつも、自分の心の平穏が乱される領域には踏み込ませない、賢い境界線のこと。
実践法：物理的に距離を置くだけでなく、心の中で「この人はこの人の課題を抱えているのだ」と理解し、過剰に同情したり、腹を立てたりしない練習。
結論：本当の優しさとは、自分を犠牲にすることではない。まず自分自身を大切にし、その上で他者を思いやることが、穏やかな人間関係の基本だと締めくくる。",,,,,待機中,,,その人とは、そっと距離を置きなさい。,,,一人の人物が、まとわりついてくる黒い影に対し、手のひらから穏やかな光の壁を作り、それ以上近づけないようにしている。人物の表情はあくまでも穏やかで、慈愛に満ちている。画面下部に、優しい白の明朝体で「その人とは、そっと距離を置きなさい。」と表示。,,,,workspaces/scripts/CH11/032/content/assembled.md,,,,,,,,,,,
33,CH11,33,CH11-033,CH11-033,【月５万円でも豊かに暮らす】ブッダの「足るを知る」という生き方｜老後の資金不安が消えるシンプルな習慣,script_validated,,workspaces/scripts/CH11/033/content/assembled.md,✅完了,9257,2025-10-29 21:44:05,,,,節約術だけでなく、仏教の「知足」の精神を通じて、心の豊かさを見出すライフスタイルを提案。お金への執着から解放され、穏やかな老後を送るためのヒントを提供する。,他人の目や言葉に振り回されがちな40〜60代。真面目で優しいがゆえに、人間関係・老後・お金・孤独の不安を抱え、仏教の整理術で心を軽くしたいと願っている人。,"導入：お金の不安の正体は、金額の大小ではなく「足りない」という心の状態だと説く。
ブッダの教え：「足るを知る者は、貧しといえども富めり」。今あるものに感謝し、満足することこそが、本当の豊かさだと解説。
実践法：①「感謝日記」をつける。今日あった良いことを3つ書き出す。②お金を使うときに「ありがとう」と感謝する。③他人と比較しない。自分の価値基準を持つ。
結論：幸せは、外に求めるものではなく、自分の心の中に見出すもの。「足るを知る」を実践すれば、どんな状況でも心は豊かでいられると締めくくる。",,,,,待機中,,,「足りない」から「満たされている」へ,,,ひび割れた古い茶碗。しかし、その中には金色の美しいお茶がなみなみと注がれ、湯気と共に光を放っている。質素なものの中にある、本当の豊かさを象徴。画面下部に、温かみのある金色の明朝体で「『足りない』から『満たされている』へ」と表示。,,,,workspaces/scripts/CH11/033/content/assembled.md,,,,,,,,,,,
